{
  "id": "WM-0020",
  "title": "Implement spatial indexes and location lifecycle cleanup",
  "summary": "Implement location stores and bounded spatial indexes for map cells, chunks and regions with cleanup on movement, despawn and destroy.",
  "state": "proposed",
  "ownerRole": "simulation-engineer",
  "reviewerRole": "reviewer",
  "dependsOn": [
    "WM-0019"
  ],
  "docs": [
    "docs/02_systems/02_entities_defs_components.md",
    "docs/02_systems/03_map_space_rooms_lanterns.md",
    "docs/06_engineering/01_performance_constitution.md",
    "docs/07_roadmap/06_m1_simulation_kernel_plan.md"
  ],
  "acceptance": [
    "Location updates maintain exactly one map or container membership per entity",
    "Spatial queries use indexed cells, chunks or regions and never scan all entities for pawn thinking",
    "Destroy/despawn cleanup removes index, reservation and occupancy references through explicit lifecycle hooks",
    "50k indexed empty or inert entities do not create sustained queue or memory growth"
  ],
  "requiredChecks": [
    "pnpm typecheck",
    "pnpm test --filter spatial-index",
    "pnpm bench --filter spatial-index",
    "node .agents/skills/wuming-town-agent-workflow/scripts/taskctl.mjs validate",
    "git diff --check"
  ],
  "branch": "task/WM-0020-implement-spatial-indexes-and-location-lifecycle",
  "createdAt": "2026-06-23T23:08:02.147Z",
  "updatedAt": "2026-06-23T23:08:02.147Z",
  "history": [
    {
      "at": "2026-06-23T23:08:02.147Z",
      "actor": "taskctl",
      "action": "create",
      "details": ""
    }
  ]
}
