{
  "id": "WM-0022",
  "title": "Implement versioned path request batching and Top K pathing",
  "summary": "Implement Region coarse pathing, local A star, batched path requests, Top-K candidate path resolution and stale navigation-version rejection.",
  "state": "ready",
  "ownerRole": "simulation-engineer",
  "reviewerRole": "reviewer",
  "dependsOn": [
    "WM-0018",
    "WM-0021"
  ],
  "docs": [
    "docs/02_systems/04_ai_jobs_reservations_pathing.md",
    "docs/02_systems/03_map_space_rooms_lanterns.md",
    "docs/05_tech/03_performance_budget.md",
    "docs/07_roadmap/06_m1_simulation_kernel_plan.md"
  ],
  "acceptance": [
    "Path requests carry map and navigation versions and stale results are discarded before state mutation",
    "Only bounded Top-K candidates receive exact local pathing in work selection",
    "No actor stores long-lived complete paths across incompatible map versions",
    "100 path benchmark reports requests, rejected stale results, node expansions and queue backlog"
  ],
  "requiredChecks": [
    "pnpm typecheck",
    "pnpm test --filter pathing",
    "pnpm bench --filter pathing-100",
    "node .agents/skills/wuming-town-agent-workflow/scripts/taskctl.mjs validate",
    "git diff --check"
  ],
  "branch": "task/WM-0022-implement-versioned-path-request-batching-and-to",
  "createdAt": "2026-06-23T23:08:02.224Z",
  "updatedAt": "2026-06-24T08:14:14.675Z",
  "history": [
    {
      "at": "2026-06-23T23:08:02.224Z",
      "actor": "taskctl",
      "action": "create",
      "details": ""
    },
    {
      "at": "2026-06-24T08:14:14.675Z",
      "actor": "project-director",
      "action": "promote-ready",
      "details": "all dependencies done"
    }
  ]
}
